{
  "event_hash": "sha256:bbbbbbbbbbbbbbbbbbbbbbbbbbbbbbbbbbbbbbbbbbbbbbbbbbbbbbbbbbbbbbbb",
  "prev_event_hash": "sha256:aaaaaaaaaaaaaaaaaaaaaaaaaaaaaaaaaaaaaaaaaaaaaaaaaaaaaaaaaaaaaaaa",
  "action": "patch.unit.completed.v1",
  "recorded_at": "2026-07-12T16:10:00Z",
  "scope": "tenant",
  "tenant_id": "acme-corp",
  "run_id": "run-0001",
  "trace_id": "bbbbbbbbbbbbbbbbbbbbbbbbbbbbbbbb",
  "payload": {"patch_unit_id": "PU-01"}
}
